[
  {
    "agency": "Acme Corp",
    "client": "Acme Corp",
    "start_date": "20260101",
    "end_date": "20260131",
    "exchange_rate": 1.0,
    "rounded_hours": 24.0,
    "source_cost": 3600.0,
    "source_currency": "$",
    "source_hourly_rate": 150.0,
    "target_cost": 3600.0,
    "target_currency": "$",
    "target_hourly_rate": 150.0,
    "task": "Backend Development",
    "user": "Jane Smith"
  },
  {
    "agency": "Acme Corp",
    "client": "Acme Corp",
    "start_date": "20260101",
    "end_date": "20260131",
    "exchange_rate": 1.0,
    "rounded_hours": 8.0,
    "source_cost": 1200.0,
    "source_currency": "$",
    "source_hourly_rate": 150.0,
    "target_cost": 1200.0,
    "target_currency": "$",
    "target_hourly_rate": 150.0,
    "task": "Code Review",
    "user": "Jane Smith"
  },
  {
    "agency": "Example Agency LLC",
    "client": "Widgetry Inc.",
    "start_date": "20260101",
    "end_date": "20260131",
    "exchange_rate": 0.92,
    "rounded_hours": 40.0,
    "source_cost": 6000.0,
    "source_currency": "$",
    "source_hourly_rate": 150.0,
    "target_cost": 5520.0,
    "target_currency": "€",
    "target_hourly_rate": 138.0,
    "task": "Platform Engineering",
    "user": "Jane Smith"
  },
  {
    "agency": "Example Agency LLC",
    "client": "Widgetry Inc.",
    "start_date": "20260201",
    "end_date": "20260228",
    "exchange_rate": 0.92,
    "rounded_hours": 40.0,
    "source_cost": 6000.0,
    "source_currency": "$",
    "source_hourly_rate": 150.0,
    "target_cost": 5520.0,
    "target_currency": "€",
    "target_hourly_rate": 138.0,
    "task": "Platform Engineering",
    "user": "Jane Smith"
  },
  {
    "agency": "Example Agency LLC",
    "client": "Beta Technologies GmbH",
    "start_date": "20260101",
    "end_date": "20260131",
    "exchange_rate": 1.09,
    "rounded_hours": 32.0,
    "source_cost": 5760.0,
    "source_currency": "€",
    "source_hourly_rate": 180.0,
    "target_cost": 6278.4,
    "target_currency": "$",
    "target_hourly_rate": 196.2,
    "task": "Systems Architecture",
    "user": "Jane Smith"
  },
  {
    "agency": "Example Agency LLC",
    "client": "Beta Technologies GmbH",
    "start_date": "20260101",
    "end_date": "20260131",
    "exchange_rate": 1.09,
    "rounded_hours": 12.0,
    "source_cost": 1560.0,
    "source_currency": "€",
    "source_hourly_rate": 130.0,
    "target_cost": 1700.4,
    "target_currency": "$",
    "target_hourly_rate": 141.7,
    "task": "Security Audit",
    "user": "Jane Smith"
  }
]
